Pos,P+,Artist and Title,Days,Pk,(x?),Streams,Streams+,7Day,7Day+,Total,Artist,Track
1,=,Ed Sheeran - Sapphire,14,1,(x7),1104662,922.0,7713661,90162,12818776,Ed Sheeran,Sapphire
2,=,Kushagra - Finding Her (w/ Bharath),107,1,(x46),991480,-35843.0,7242227,-119065,106167438,Kushagra,Finding Her (w/ Bharath)
3,=,Shubh - Supreme,61,2,(x23),861503,-38516.0,6087956,-29280,48635967,Shubh,Supreme
4,=,Sanju Rathod - Shaky (w/ G-SPXRK),35,4,,817675,2481.0,5567649,107024,17809075,Sanju Rathod,Shaky (w/ G-SPXRK)
5,=,"Sachet-Parampara - Raanjhan (From ""Do Patti"") (w/ Parampara Tandon, Kausar Munir)",243,1,(x42),749546,-198.0,5156080,-5450,214720529,Sachet-Parampara,"Raanjhan (From ""Do Patti"") (w/ Parampara Tandon, Kausar Munir)"
6,=,Anuv Jain - Jo Tum Mere Ho,314,1,(x105),671935,-24301.0,4881858,-48372,283306484,Anuv Jain,Jo Tum Mere Ho
7,=,Faheem Abdullah - Ishq (w/ Rauhan Malik),391,2,(x14),645568,-12276.0,4629482,-52178,236810422,Faheem Abdullah,Ishq (w/ Rauhan Malik)
8,=,"A.R. Rahman - Tere Bina (w/ Chinmayi, Murtuza Khan, Qadir Khan, Abhishek Bachchan, Aishwarya Rai Bachchan, R. Madhavan, Vidya Balan, Mithun Chakraborty, Arya Babbar)",305,7,,625784,-2653.0,4410620,46636,83542037,A.R. Rahman,"Tere Bina (w/ Chinmayi, Murtuza Khan, Qadir Khan, Abhishek Bachchan, Aishwarya Rai Bachchan, R. Madhavan, Vidya Balan, Mithun Chakraborty, Arya Babbar)"
9,=,"Sachin-Jigar - Apna Bana Le (w/ Arijit Singh, Amitabh Bhattacharya)",596,1,(x14),586457,-2995.0,4237134,4445,298096879,Sachin-Jigar,"Apna Bana Le (w/ Arijit Singh, Amitabh Bhattacharya)"
10,+3,Gajendra Verma - Mann Mera,1062,10,,568158,19975.0,3481280,147908,253825568,Gajendra Verma,Mann Mera
11,-1,"Guru Randhawa - Qatal (w/ Sanjoy, Gill Machhrai)",54,2,(x2),555893,-11346.0,4005526,-11918,33124262,Guru Randhawa,"Qatal (w/ Sanjoy, Gill Machhrai)"
12,=,Pritam - Ye Tune Kya Kiya (w/ Javed Bashir),497,8,,550161,-5877.0,4036122,-20907,148699758,Pritam,Ye Tune Kya Kiya (w/ Javed Bashir)
13,-2,"Yo Yo Honey Singh - Laal Pari (From ""Housefull 5"") (w/ Simar Kaur, Alfaaz, Vinod Verma)",43,10,,542255,-18328.0,3799461,5961,19015535,Yo Yo Honey Singh,"Laal Pari (From ""Housefull 5"") (w/ Simar Kaur, Alfaaz, Vinod Verma)"
14,=,Aditya Rikhari - Paro (w/ UNPLG'd),109,6,,514209,-11869.0,3542438,35933,56525438,Aditya Rikhari,Paro (w/ UNPLG'd)
15,=,"Jasleen Royal - Sahiba (w/ Stebin Ben, Vijay Deverakonda, Radhikka Madan, Priya Saraiya, Aditya Sharma)",210,1,(x21),470293,-21414.0,3382667,-28360,130262017,Jasleen Royal,"Sahiba (w/ Stebin Ben, Vijay Deverakonda, Radhikka Madan, Priya Saraiya, Aditya Sharma)"
16,+3,"Arijit Singh - Tujhe Kitna Chahne Lage (From ""Kabir Singh"") (w/ Mithoon)",2211,2,(x50),444234,4871.0,3099056,13185,474849519,Arijit Singh,"Tujhe Kitna Chahne Lage (From ""Kabir Singh"") (w/ Mithoon)"
17,=,"Anurag Saikia - Ishq Hai (w/ Raj Shekhar, Romy, Amarabha Banerjee, Varun Jain, Madhubanti Bagchi, Mismatched - Cast)",187,1,(x34),442834,611.0,3185196,-48552,143784175,Anurag Saikia,"Ishq Hai (w/ Raj Shekhar, Romy, Amarabha Banerjee, Varun Jain, Madhubanti Bagchi, Mismatched - Cast)"
18,=,AP Dhillon - STFU (w/ Shinda Kahlon),38,14,,425216,-14434.0,2988011,-9514,15844040,AP Dhillon,STFU (w/ Shinda Kahlon)
19,+3,"Alka Yagnik - Agar Tum Saath Ho (From ""Tamasha"") (w/ Arijit Singh)",2087,4,,423820,11388.0,2812286,49573,463949787,Alka Yagnik,"Agar Tum Saath Ho (From ""Tamasha"") (w/ Arijit Singh)"
20,+4,"Arijit Singh - Humdard (From ""Ek Villain"")",1806,15,,423426,14474.0,2839097,26070,318408288,Arijit Singh,"Humdard (From ""Ek Villain"")"
21,-5,"Ram Sampath - Sajni (From ""Laapataa Ladies"") (w/ Arijit Singh, Prashant Pandey)",413,1,(x59),423031,-28912.0,3164775,-24970,283579015,Ram Sampath,"Sajni (From ""Laapataa Ladies"") (w/ Arijit Singh, Prashant Pandey)"
22,-1,"Arijit Singh - Satranga (From ""ANIMAL"") (w/ Shreyas Puranik, Siddharth - Garima)",601,2,(x43),416734,862.0,2753358,46624,349544647,Arijit Singh,"Satranga (From ""ANIMAL"") (w/ Shreyas Puranik, Siddharth - Garima)"
23,-3,Jasleen Royal - Sang Rahiyo,463,14,,406595,-18852.0,2832006,21170,151313696,Jasleen Royal,Sang Rahiyo
24,+4,Atif Aslam - Jeena Jeena,775,17,,402694,8533.0,2767695,50125,202252716,Atif Aslam,Jeena Jeena
25,+5,"Altamash Faridi - Aashiq Tera (w/ Sohail Sen, Mudassar Aziz)",102,20,,400877,19123.0,2665501,12468,33771480,Altamash Faridi,"Aashiq Tera (w/ Sohail Sen, Mudassar Aziz)"
26,=,"Vishal-Shekhar - Ishq Bulaava (w/ Sanam Puri, Shipra Goyal)",90,21,,400670,732.0,2481675,50491,24270430,Vishal-Shekhar,"Ishq Bulaava (w/ Sanam Puri, Shipra Goyal)"
27,-4,Karan Aujla - Wavy,216,4,,398858,-10309.0,2748358,8048,109990985,Karan Aujla,Wavy
28,-3,"Jakes Bejoy - Minnalvala (w/ Sid Sriram, Sithara Krishnakumar)",27,7,,397089,-7265.0,3095116,-33189,12924892,Jakes Bejoy,"Minnalvala (w/ Sid Sriram, Sithara Krishnakumar)"
29,-2,Anuv Jain - Afsos (w/ AP Dhillon),140,5,,385616,-8873.0,2633252,18522,69853711,Anuv Jain,Afsos (w/ AP Dhillon)
30,-1,"Sachet-Parampara - Maiyya (w/ Sachet Tandon, Parampara Tandon, Kausar Munir)",196,18,,372926,-16538.0,2332578,63972,62776935,Sachet-Parampara,"Maiyya (w/ Sachet Tandon, Parampara Tandon, Kausar Munir)"
31,=,"Pritam - Zamaana Lage (From ""Metro ... In Dino"") (w/ Arijit Singh, Shashwat Singh, Qaisar-Ul-Jafri, Sandeep Srivastava)",22,19,,370793,-4418.0,2541650,-12550,7729454,Pritam,"Zamaana Lage (From ""Metro ... In Dino"") (w/ Arijit Singh, Shashwat Singh, Qaisar-Ul-Jafri, Sandeep Srivastava)"
32,+6,"Sachin-Jigar - Tum Se (From ""Teri Baaton Mein Aisa Uljha Jiya"") (w/ Raghav Chaitanya, Varun Jain, Indraneel)",491,9,,365193,12607.0,2525658,-978,184200888,Sachin-Jigar,"Tum Se (From ""Teri Baaton Mein Aisa Uljha Jiya"") (w/ Raghav Chaitanya, Varun Jain, Indraneel)"
33,=,Jeet Gannguli - Jo Tere Sang (w/ Mustafa Zahid),49,33,,360996,-2790.0,2342994,15397,12607393,Jeet Gannguli,Jo Tere Sang (w/ Mustafa Zahid)
34,+1,Mithoon - Tum Hi Ho (w/ Arijit Singh),430,24,,359387,336.0,2437153,32483,125405454,Mithoon,Tum Hi Ho (w/ Arijit Singh)
35,-3,Shubh - Cheques,754,1,(x27),353076,-17201.0,2597005,-5883,347307510,Shubh,Cheques
36,+5,"Sachet Tandon - Mere Sohneya (From ""Kabir Singh"") (w/ Parampara Tandon, Sachet-Parampara)",1886,4,,350959,1457.0,2516236,-35674,274047380,Sachet Tandon,"Mere Sohneya (From ""Kabir Singh"") (w/ Parampara Tandon, Sachet-Parampara)"
37,+3,Zain Zohaib - Ranjheya Ve,116,18,,349121,-620.0,2324626,25082,41117578,Zain Zohaib,Ranjheya Ve
38,-4,Lady Gaga - Die With A Smile (w/ Bruno Mars),268,3,(x2),348672,-11776.0,2559625,-16712,126667965,Lady Gaga,Die With A Smile (w/ Bruno Mars)
39,+3,Atif Aslam - Dil Diyan Gallan,1931,20,,345754,7284.0,2279535,16575,247221532,Atif Aslam,Dil Diyan Gallan
40,+7,"A.R. Rahman - Muththa Mazhai (Reprise) (w/ Chinmayi, Siva Ananth)",15,37,,340441,9491.0,2320589,68185,4348717,A.R. Rahman,"Muththa Mazhai (Reprise) (w/ Chinmayi, Siva Ananth)"
41,-4,Karan Aujla - Courtside (w/ Signature By SB),37,11,,339583,-14287.0,2464668,-17356,15764164,Karan Aujla,Courtside (w/ Signature By SB)
42,-6,Sachin-Jigar - Tainu Khabar Nahi (w/ Arijit Singh),372,16,,336262,-17895.0,2485228,-10845,133535539,Sachin-Jigar,Tainu Khabar Nahi (w/ Arijit Singh)
43,=,Anuv Jain - Husn,567,1,(x23),332595,-4416.0,2334351,25806,318146334,Anuv Jain,Husn
44,-5,"Sachin-Jigar - Aaj Ki Raat (From ""Stree 2"") (w/ Madhubanti Bagchi, Divya Kumar, Amitabh Bhattacharya)",328,1,(x28),331760,-20187.0,2459645,869,199872223,Sachin-Jigar,"Aaj Ki Raat (From ""Stree 2"") (w/ Madhubanti Bagchi, Divya Kumar, Amitabh Bhattacharya)"
45,+11,"Arijit Singh - Mast Magan (From ""2 States"") (w/ Chinmayi)",1584,36,,326860,22067.0,2111099,34030,256210868,Arijit Singh,"Mast Magan (From ""2 States"") (w/ Chinmayi)"
46,+3,Karan Aujla - Softly (w/ Ikky),670,4,,325110,3889.0,2284884,13699,272125141,Karan Aujla,Softly (w/ Ikky)
47,-3,"Jasleen Royal - Ranjha (From ""Shershaah"") (w/ B Praak, Romy, Anvita Dutt)",1221,1,(x6),324492,-11901.0,2331257,-4660,379440689,Jasleen Royal,"Ranjha (From ""Shershaah"") (w/ B Praak, Romy, Anvita Dutt)"
48,+9,"Shankar-Ehsaan-Loy - Mitwa (w/ Shankar Mahadevan, Caralisa Monteiro, Shafqat Amanat Ali)",313,48,,324130,21021.0,2103395,31852,65905225,Shankar-Ehsaan-Loy,"Mitwa (w/ Shankar Mahadevan, Caralisa Monteiro, Shafqat Amanat Ali)"
49,+5,"Kailash Kher - Teri Deewani (w/ Paresh Kamath, Naresh Kamath)",316,40,,322598,13072.0,2130340,14992,67870150,Kailash Kher,"Teri Deewani (w/ Paresh Kamath, Naresh Kamath)"
50,+5,Anuv Jain - Baarishein,1499,15,,322370,13019.0,2141923,43966,326184537,Anuv Jain,Baarishein
51,+15,Atif Aslam - Pehli Dafa (w/ Shiraz Uppal),604,34,,321856,29002.0,1965074,42778,119882599,Atif Aslam,Pehli Dafa (w/ Shiraz Uppal)
52,-7,Masoom Sharma - 2 Khatole (Lofi Mix),81,13,,320375,-12965.0,2275656,-12281,28254232,Masoom Sharma,2 Khatole (Lofi Mix)
53,-2,"A.R. Rahman - Raanjhanaa (w/ Jaswinder Singh, Shiraz Uppal)",304,48,,319919,5157.0,2069256,64010,45675059,A.R. Rahman,"Raanjhanaa (w/ Jaswinder Singh, Shiraz Uppal)"
54,-6,Shubh - Fell For You,139,13,,318567,-9695.0,2295750,-22901,39454130,Shubh,Fell For You
55,-3,"Atif Aslam - O Saathi (w/ Arko, Tiger Shroff, Disha Patani, Randeep Hooda, Manoj Bajpayee, Prateik Babbar)",1053,21,,317329,6133.0,2164257,-20058,152170092,Atif Aslam,"O Saathi (w/ Arko, Tiger Shroff, Disha Patani, Randeep Hooda, Manoj Bajpayee, Prateik Babbar)"
56,+8,Udit Narayan - Jugraafiya (w/ Shreya Ghoshal),157,49,,314305,18260.0,1731028,116677,5570518,Udit Narayan,Jugraafiya (w/ Shreya Ghoshal)
57,+3,"Atif Aslam - Jeene Laga Hoon (w/ Shreya Ghoshal, Sachin-Jigar)",280,21,,311021,11914.0,2080662,12293,71999040,Atif Aslam,"Jeene Laga Hoon (w/ Shreya Ghoshal, Sachin-Jigar)"
58,-8,Karan Aujla - Winning Speech (w/ Mxrci),397,6,,305869,-9069.0,2162260,-3146,125897126,Karan Aujla,Winning Speech (w/ Mxrci)
59,-6,"Masoom Sharma - Pistol Bole Gi (w/ Sheenam Katholic, Kay D, Aarohi Raghav)",95,16,,305112,-5077.0,2198070,-14659,33681291,Masoom Sharma,"Pistol Bole Gi (w/ Sheenam Katholic, Kay D, Aarohi Raghav)"
60,+9,"Akhil Sachdeva - Humsafar (From ""Badrinath Ki Dulhania"") (w/ Mansheel Gujral)",506,36,,302515,15294.0,1907338,35962,93945464,Akhil Sachdeva,"Humsafar (From ""Badrinath Ki Dulhania"") (w/ Mansheel Gujral)"
61,+9,"Mohammad Faiz - Dekhha Tenu (From ""Mr. And Mrs. Mahi"") (w/ Jaani)",398,2,(x38),301669,15809.0,1940056,28468,163802240,Mohammad Faiz,"Dekhha Tenu (From ""Mr. And Mrs. Mahi"") (w/ Jaani)"
62,-16,Pritam - Zara Sa (w/ KK),813,7,,301170,-31116.0,2117030,33932,143381355,Pritam,Zara Sa (w/ KK)
63,-5,Shubh - One Love,672,3,(x36),300764,-1364.0,2133574,75,298233870,Shubh,One Love
64,+3,Ami Mishra - Hasi - Male Version,725,56,,297984,8035.0,1887867,70941,141317683,Ami Mishra,Hasi - Male Version
65,+11,Faheem Abdullah - Sajde (w/ Huzaif Nazar),20,65,,297599,17388.0,1862763,59013,4550007,Faheem Abdullah,Sajde (w/ Huzaif Nazar)
66,+13,Pritam - Shayad (w/ Arijit Singh),1950,1,(x93),296611,25569.0,1909394,19261,408671063,Pritam,Shayad (w/ Arijit Singh)
67,-2,Juss - Suniyan Suniyan (w/ MixSingh),401,2,(x1),293543,-997.0,2004833,29433,158886722,Juss,Suniyan Suniyan (w/ MixSingh)
68,-9,Hariharan - Shree Hanuman Chalisa,1043,5,,292399,-9488.0,2065804,20867,240124205,Hariharan,Shree Hanuman Chalisa
69,+3,Atif Aslam - Tu Jaane Na (w/ Pritam),1316,35,,291594,9004.0,2112188,-19296,194302973,Atif Aslam,Tu Jaane Na (w/ Pritam)
70,-9,"Sachin-Jigar - Saibo (w/ Shreya Ghoshal, Tochi Raina)",1698,18,,289372,-8379.0,1973536,14720,295262025,Sachin-Jigar,"Saibo (w/ Shreya Ghoshal, Tochi Raina)"
71,-9,Sachet Tandon - Maiyya Mainu,500,48,,288112,-8511.0,2000893,6325,98976275,Sachet Tandon,Maiyya Mainu
72,+5,"Tanishk Bagchi - Saiyaara (From ""Saiyaara"") (w/ Faheem Abdullah, Arslan Nizami, Irshad Kamil)",8,56,,286004,7022.0,1784183,68569,2001618,Tanishk Bagchi,"Saiyaara (From ""Saiyaara"") (w/ Faheem Abdullah, Arslan Nizami, Irshad Kamil)"
73,-2,Pritam - Tum Se Hi (w/ Mohit Chauhan),1910,7,,285865,3197.0,1921767,26027,375806509,Pritam,Tum Se Hi (w/ Mohit Chauhan)
74,+1,Ed Sheeran - Shape of You,1711,60,,282283,1938.0,1984488,31324,210489317,Ed Sheeran,Shape of You
75,-12,Arijit Singh - Tera Chehra,45,7,,280971,-15520.0,2047621,-14934,15583053,Arijit Singh,Tera Chehra
76,-2,"Ajay Bhagta - Jaat Intro (w/ Manisha Sharma, Kb Dhull, Pranjal Dahiya)",22,54,,279241,-1236.0,1970919,-7547,5852515,Ajay Bhagta,"Jaat Intro (w/ Manisha Sharma, Kb Dhull, Pranjal Dahiya)"
77,+7,Masoom Sharma - Raat Ke Shikari,12,77,,278634,12054.0,1660766,72300,2643488,Masoom Sharma,Raat Ke Shikari
78,-10,"Amit Trivedi - Uyi Amma (w/ Madhubanti Bagchi, Amitabh Bhattacharya)",149,8,,277826,-11061.0,2026006,-6285,47674711,Amit Trivedi,"Uyi Amma (w/ Madhubanti Bagchi, Amitabh Bhattacharya)"
79,-1,"Atif Aslam - Tera Hone Laga Hoon (w/ Alisha Chinai, Pritam)",1500,20,,277099,4047.0,1927258,-1592,279963588,Atif Aslam,"Tera Hone Laga Hoon (w/ Alisha Chinai, Pritam)"
80,=,"Pritam - O Maahi (w/ Arijit Singh, Irshad Kamil)",547,4,,274755,3787.0,1971483,12500,220834995,Pritam,"O Maahi (w/ Arijit Singh, Irshad Kamil)"
81,+7,Arijit Singh - Zaalima (w/ Harshdeep Kaur),726,48,,272312,10318.0,1945594,5659,85497264,Arijit Singh,Zaalima (w/ Harshdeep Kaur)
82,+31,Arko - Nazm Nazm,381,45,,263399,23160.0,1645847,15603,51042696,Arko,Nazm Nazm
83,+11,"Pritam - Kesariya (w/ Arijit Singh, Amitabh Bhattacharya)",988,1,(x44),263275,7112.0,1948839,-12656,442645206,Pritam,"Kesariya (w/ Arijit Singh, Amitabh Bhattacharya)"
84,+1,"Masoom Sharma - Blender (w/ Swara Verma, Dev Chouhan, Pooja Saxena)",166,15,,260739,-4325.0,1756492,17352,44977277,Masoom Sharma,"Blender (w/ Swara Verma, Dev Chouhan, Pooja Saxena)"
85,-3,Aditya Rikhari - Paaro,96,34,,260343,-7915.0,1815745,6575,27793964,Aditya Rikhari,Paaro
86,-5,Shubh - Aura,125,44,,259898,-11001.0,1895517,-16032,30196429,Shubh,Aura
87,+11,Shaarib Toshi - Maahi (w/ Toshi Sabri),34,65,,258865,5822.0,1742192,17457,7531849,Shaarib Toshi,Maahi (w/ Toshi Sabri)
88,+9,Pritam - Hawayein (w/ Arijit Singh),1359,45,,258826,3430.0,1823656,24689,189669432,Pritam,Hawayein (w/ Arijit Singh)
89,+2,"Sachin-Jigar - Aayi Nai (From ""Stree 2"") (w/ Pawan Singh, Simran Choudhary, Divya Kumar, Amitabh Bhattacharya)",320,2,(x18),257898,-2519.0,1848103,5351,144645792,Sachin-Jigar,"Aayi Nai (From ""Stree 2"") (w/ Pawan Singh, Simran Choudhary, Divya Kumar, Amitabh Bhattacharya)"
90,+11,Ayushmann Khurrana - Pani Da Rang - Male Vocals,274,73,,257349,9026.0,1598021,39815,49765321,Ayushmann Khurrana,Pani Da Rang - Male Vocals
91,+14,"Vishal Mishra - Kaise Hua (From ""Kabir Singh"")",2198,4,,257293,11134.0,1690152,39975,392620775,Vishal Mishra,"Kaise Hua (From ""Kabir Singh"")"
92,+1,Roop Kumar Rathod - Maula Mere Maula,252,64,,255564,-851.0,1828872,6382,47870440,Roop Kumar Rathod,Maula Mere Maula
93,+17,"Vishal-Shekhar - Bulleya (w/ Papon, Irshad Kamil)",170,29,,254402,11358.0,1696457,1138,45774864,Vishal-Shekhar,"Bulleya (w/ Papon, Irshad Kamil)"
94,-21,Pritam - Teri Jhuki Nazar (w/ Shafqat Amanat Ali),53,57,,253809,-28286.0,1784995,-19157,9576593,Pritam,Teri Jhuki Nazar (w/ Shafqat Amanat Ali)
95,+1,KK - Ajab Si,351,8,,252593,-2969.0,1864562,-32514,75311946,KK,Ajab Si
96,+4,"Talwiinder - Haseen (w/ NDS, Rippy Grewal)",21,96,,251643,2096.0,1610491,36468,4367079,Talwiinder,"Haseen (w/ NDS, Rippy Grewal)"
97,+11,Shankar-Ehsaan-Loy - Tere Naina (w/ Shafqat Amanat Ali),161,78,,251185,7942.0,1692529,-11054,33754281,Shankar-Ehsaan-Loy,Tere Naina (w/ Shafqat Amanat Ali)
98,-3,"Mitraz - Akhiyaan Gulaab (From ""Teri Baaton Mein Aisa Uljha Jiya"")",513,2,(x25),251152,-4895.0,1813921,3600,216576406,Mitraz,"Akhiyaan Gulaab (From ""Teri Baaton Mein Aisa Uljha Jiya"")"
99,-9,Shubh - Bandana,447,5,,251112,-9609.0,1751554,-8635,132002054,Shubh,Bandana
100,-8,Dhanda Nyoliwala - Russian Bandana,263,5,,249040,-9181.0,1756735,-5295,102640523,Dhanda Nyoliwala,Russian Bandana
101,-12,"Pritam - Ae Dil Hai Mushkil Title Track (From ""Ae Dil Hai Mushkil"") (w/ Arijit Singh)",1941,56,,247755,-13237.0,1769009,8531,223180998,Pritam,"Ae Dil Hai Mushkil Title Track (From ""Ae Dil Hai Mushkil"") (w/ Arijit Singh)"
102,-3,"Masoom Sharma - Chambal K Dakku (w/ Rahul Muana, Swara Verma, Ruba Khan)",95,19,,247340,-3674.0,1742852,-195,28771618,Masoom Sharma,"Chambal K Dakku (w/ Rahul Muana, Swara Verma, Ruba Khan)"
103,-17,Shankar-Ehsaan-Loy - Ishq Di Baajiyaan (w/ Diljit Dosanjh),288,59,,246706,-17809.0,1700007,33841,57503973,Shankar-Ehsaan-Loy,Ishq Di Baajiyaan (w/ Diljit Dosanjh)
104,+8,Harshit Saxena - Hale Dil,208,73,,246607,5664.0,1692668,5696,40300778,Harshit Saxena,Hale Dil
105,+10,Aditya Rikhari - Samjho Na,790,20,,245681,7954.0,1641640,35965,177984130,Aditya Rikhari,Samjho Na
106,-4,Ed Sheeran - Perfect,1884,24,,245670,-2229.0,1691633,15441,293482894,Ed Sheeran,Perfect
107,+17,Atif Aslam - Hona Tha Pyar (w/ Hadiqa Kiani),115,39,,243738,13185.0,1667217,-13596,28940175,Atif Aslam,Hona Tha Pyar (w/ Hadiqa Kiani)
108,-21,Arijit Singh - Tera Fitoor,676,55,,241040,-22959.0,1608103,25139,132519148,Arijit Singh,Tera Fitoor
109,+8,Aparshakti Khurana - Zaroor (w/ Savi Kahlon),317,13,,238302,2200.0,1574447,45733,86509931,Aparshakti Khurana,Zaroor (w/ Savi Kahlon)
110,+25,Ankit Tiwari - Sanam Teri Kasam (w/ Palak Muchhal),48,1,(x1),238045,17155.0,1452441,23727,15030236,Ankit Tiwari,Sanam Teri Kasam (w/ Palak Muchhal)
111,+7,"Jasleen Royal - Heeriye (w/ Arijit Singh, Dulquer Salmaan)",692,1,(x27),236225,251.0,1691295,11147,371115540,Jasleen Royal,"Heeriye (w/ Arijit Singh, Dulquer Salmaan)"
112,-29,"Sachin-Jigar - Tumhare Hi Rahenge Hum (From ""Stree 2"") (w/ Shilpa Rao, Varun Jain, Amitabh Bhattacharya)",308,7,,235369,-32009.0,1831479,-28455,111757745,Sachin-Jigar,"Tumhare Hi Rahenge Hum (From ""Stree 2"") (w/ Shilpa Rao, Varun Jain, Amitabh Bhattacharya)"
113,+23,"Shankar-Ehsaan-Loy - O Rangrez (w/ Shreya Ghoshal, Javed Bashir, Yusuf Mohammed, Vajid Ali)",224,40,,234806,13992.0,1565062,15741,53060715,Shankar-Ehsaan-Loy,"O Rangrez (w/ Shreya Ghoshal, Javed Bashir, Yusuf Mohammed, Vajid Ali)"
114,-11,Pritam - Raabta (w/ Arijit Singh),950,41,,234755,-12766.0,1668004,-895,173666700,Pritam,Raabta (w/ Arijit Singh)
115,-9,"Pritam - Ve Kamleya (From ""Rocky Aur Rani Kii Prem Kahaani"") (w/ Arijit Singh, Shreya Ghoshal, Shadab Faridi, Altamash Faridi, Amitabh Bhattacharya)",673,15,,234637,-10404.0,1684999,-1478,168903279,Pritam,"Ve Kamleya (From ""Rocky Aur Rani Kii Prem Kahaani"") (w/ Arijit Singh, Shreya Ghoshal, Shadab Faridi, Altamash Faridi, Amitabh Bhattacharya)"
116,+25,"A.R. Rahman - Tum Tak (w/ Javed Ali, KIRTI SAGATHIA, Pooja AV)",236,79,,234290,15810.0,1485388,30508,45188298,A.R. Rahman,"Tum Tak (w/ Javed Ali, KIRTI SAGATHIA, Pooja AV)"
117,-13,Arctic Monkeys - I Wanna Be Yours,953,47,,233469,-13527.0,1610228,13042,208454607,Arctic Monkeys,I Wanna Be Yours
118,+9,"Karan Aujla - Admirin' You (w/ Ikky, Preston Pablo)",688,21,,231703,4153.0,1632186,4044,162016847,Karan Aujla,"Admirin' You (w/ Ikky, Preston Pablo)"
119,+1,Pritam - Tu Hi Mera (w/ Shafqat Amanat Ali),12,119,,229381,-3060.0,1472782,49463,2507495,Pritam,Tu Hi Mera (w/ Shafqat Amanat Ali)
120,-1,Yo Yo Honey Singh - Millionaire,298,2,(x2),229064,-3533.0,1632367,-1102,146378626,Yo Yo Honey Singh,Millionaire
121,+7,Sai Abhyankkar - Aasa Kooda (w/ Sai Smriti),364,3,(x29),228510,1606.0,1562872,13149,126987184,Sai Abhyankkar,Aasa Kooda (w/ Sai Smriti)
122,-15,Diljit Dosanjh - Water,117,26,,228451,-15145.0,1670609,-11254,33389322,Diljit Dosanjh,Water
123,+35,"Pritam - Subhanallah (w/ Sreeram, Shilpa Rao)",815,25,,227134,19674.0,1443433,5644,162200709,Pritam,"Subhanallah (w/ Sreeram, Shilpa Rao)"
124,-1,"dox - Superstar (w/ JASKARAN, Rita Kim)",72,58,,226178,-5000.0,1593967,-450,18197269,dox,"Superstar (w/ JASKARAN, Rita Kim)"
125,-14,AP Dhillon - Old Money,230,12,,226132,-16443.0,1652190,8249,68429723,AP Dhillon,Old Money
126,-4,The Weeknd - Starboy (w/ Daft Punk),1421,9,,225950,-5981.0,1604587,2651,256945295,The Weeknd,Starboy (w/ Daft Punk)
127,-6,Vishal Mishra - Pehle Bhi Main (w/ Raj Shekhar),568,1,(x124),225613,-6722.0,1603118,-1763,345218336,Vishal Mishra,Pehle Bhi Main (w/ Raj Shekhar)
128,-2,Jeet Gannguli - Hamari Adhuri Kahani (Title Track) (w/ Arijit Singh),1276,50,,225592,-2929.0,1479346,20315,226068701,Jeet Gannguli,Hamari Adhuri Kahani (Title Track) (w/ Arijit Singh)
129,-13,Mustafa Zahid - Tera Mera Rishta,93,69,,224367,-12248.0,1588961,-10264,19234605,Mustafa Zahid,Tera Mera Rishta
130,-21,Pritam - Dil Ibaadat (w/ KK),183,11,,223633,-19541.0,1622782,13407,30260956,Pritam,Dil Ibaadat (w/ KK)
131,-17,"Atif Aslam - Woh Lamhe Woh Baatein (w/ Roop Kumar Rathod, Mithun Sharma, Naresh Sharma)",76,73,,222222,-16104.0,1532773,20954,16286657,Atif Aslam,"Woh Lamhe Woh Baatein (w/ Roop Kumar Rathod, Mithun Sharma, Naresh Sharma)"
132,+12,yung kai - blue,194,14,,221957,5036.0,1544019,4531,58038477,yung kai,blue
133,-3,"Pritam - Kabira (w/ Tochi Raina, Rekha Bhardwaj)",2103,30,,219377,-5451.0,1681511,-25873,281621396,Pritam,"Kabira (w/ Tochi Raina, Rekha Bhardwaj)"
134,+15,"Mohammed Irfan - Banjaara (From ""Ek Villain"")",418,111,,218796,5240.0,1442408,11632,71314424,Mohammed Irfan,"Banjaara (From ""Ek Villain"")"
135,-2,Diljit Dosanjh - Born to Shine,726,12,,217129,-4127.0,1513187,11290,153220921,Diljit Dosanjh,Born to Shine
136,+18,Akhil Sachdeva - Channa Ve (w/ Mansheel Gujral),513,30,,217117,7252.0,1470451,-12499,98526151,Akhil Sachdeva,Channa Ve (w/ Mansheel Gujral)
137,+2,Josh Brar - Tere Bina Na Guzara E,250,16,,216663,-2411.0,1529805,-5251,69460842,Josh Brar,Tere Bina Na Guzara E
138,-4,"Kailash Kher - Saiyyan (w/ Paresh Kamath, Naresh Kamath)",524,51,,216460,-4568.0,1526856,8768,97915691,Kailash Kher,"Saiyyan (w/ Paresh Kamath, Naresh Kamath)"
139,-1,"AP Dhillon - Excuses (w/ Gurinder Gill, Intense)",1337,1,(x101),216318,-3052.0,1498920,24299,449127628,AP Dhillon,"Excuses (w/ Gurinder Gill, Intense)"
140,-11,Divya Kumar - Sun Saathiya (w/ Priya Saraiya),173,108,,215787,-9478.0,1529417,17232,28536059,Divya Kumar,Sun Saathiya (w/ Priya Saraiya)
141,-16,Karan Aujla - 52 Bars (w/ Ikky),295,8,,215304,-14068.0,1512133,-2909,64796640,Karan Aujla,52 Bars (w/ Ikky)
142,+25,"Pritam - Tu Hi Haqeeqat (w/ Javed Ali, Irshan Ashraf, Shadab)",73,142,,214953,11297.0,1139713,214953,12215779,Pritam,"Tu Hi Haqeeqat (w/ Javed Ali, Irshan Ashraf, Shadab)"
143,-1,Pritam - Tum Mile (w/ Neeraj Shridhar),73,67,,214432,-3014.0,1561385,-22118,13837520,Pritam,Tum Mile (w/ Neeraj Shridhar)
144,-4,One Direction - Night Changes,1384,19,,214184,-4558.0,1463976,24848,242638500,One Direction,Night Changes
145,+28,"Mustafa Zahid - Zaroorat (From ""Ek Villain"")",69,90,,212439,11033.0,1440603,505,13795772,Mustafa Zahid,"Zaroorat (From ""Ek Villain"")"
146,+31,"Arijit Singh - Itni Si Baat Hain (From ""Azhar"") (w/ Antara Mitra)",226,58,,212380,14690.0,1366655,27217,41998562,Arijit Singh,"Itni Si Baat Hain (From ""Azhar"") (w/ Antara Mitra)"
147,+1,Sanju Rathod - Gulabi Sadi (w/ G-Spark),172,10,,212097,-2674.0,1506349,9087,46940546,Sanju Rathod,Gulabi Sadi (w/ G-Spark)
148,+16,Shaarib Toshi - Bandeya (w/ Arijit Singh),560,61,,210786,5241.0,1146300,23185,83885990,Shaarib Toshi,Bandeya (w/ Arijit Singh)
149,+1,"Sidhu Moose Wala - 0008 (w/ Jenny Johal, The Kidd)",9,32,,210177,-2101.0,1651890,-90271,2318568,Sidhu Moose Wala,"0008 (w/ Jenny Johal, The Kidd)"
150,+3,Masoom Sharma - Lofar (w/ Swara Verma),80,20,,210144,135.0,1453255,-1018,19197350,Masoom Sharma,Lofar (w/ Swara Verma)
151,+33,Pritam - Pee Loon (w/ Mohit Chauhan),492,29,,209952,16091.0,1361955,33768,111086884,Pritam,Pee Loon (w/ Mohit Chauhan)
152,-20,"Lijo George-Dj Chetas - Jaana Samjho Na (From ""Bhool Bhulaiyaa 3"") (w/ Aditya Rikhari, Tulsi Kumar)",232,8,,209731,-11736.0,1521032,-13470,83082270,Lijo George-Dj Chetas,"Jaana Samjho Na (From ""Bhool Bhulaiyaa 3"") (w/ Aditya Rikhari, Tulsi Kumar)"
153,+2,"Vishal-Shekhar - Khuda Jaane (w/ KK, Shilpa Rao)",976,6,,209362,-362.0,1451528,5264,199357347,Vishal-Shekhar,"Khuda Jaane (w/ KK, Shilpa Rao)"
154,-9,Yo Yo Honey Singh - Payal (w/ Paradox),212,12,,209202,-7242.0,1603068,2691,67515850,Yo Yo Honey Singh,Payal (w/ Paradox)
155,-24,Glass Animals - Heat Waves,869,3,(x5),208888,-15869.0,1532941,34252,194662469,Glass Animals,Heat Waves
156,-5,Pritam - Kalank - Title Track (w/ Arijit Singh),514,34,,208519,-2535.0,1496997,6386,94597012,Pritam,Kalank - Title Track (w/ Arijit Singh)
157,+41,Monty Sharma - Jab Se Tere Naina (w/ Shaan),8,157,,208037,22259.0,578024,31421,1485144,Monty Sharma,Jab Se Tere Naina (w/ Shaan)
158,-12,Atif Aslam - Tere Sang Yaara (w/ Manoj Muntashir),323,34,,207922,-8168.0,1446358,14779,62037707,Atif Aslam,Tere Sang Yaara (w/ Manoj Muntashir)
159,NEW,"Jubin Nautiyal - Ishq Mera (Feat. Esha Gupta) (w/ Akashdeep Sengupta, Mukund Suryawanshi)",1,159,,207817,,207817,207817,207817,Jubin Nautiyal,"Ishq Mera (Feat. Esha Gupta) (w/ Akashdeep Sengupta, Mukund Suryawanshi)"
160,+3,Nihal Sadiq - Chirapunji (w/ Hanan Shaah),2,160,,206952,1399.0,412505,206952,412505,Nihal Sadiq,Chirapunji (w/ Hanan Shaah)
161,-14,A.R. Rahman - Nee Singam Dhan (w/ Sid Sriram),148,62,,206874,-8984.0,1578857,-19208,28352147,A.R. Rahman,Nee Singam Dhan (w/ Sid Sriram)
162,-25,Yo Yo Honey Singh - Desi Kalakaar,525,9,,205826,-14529.0,1508040,12151,130438352,Yo Yo Honey Singh,Desi Kalakaar
163,-20,"Vishal Mishra - Janiye (from the Netflix Film ""Chor Nikal Ke Bhaga"") (w/ Rashmeet Kaur)",716,4,,204981,-12050.0,1430379,5164,266672407,Vishal Mishra,"Janiye (from the Netflix Film ""Chor Nikal Ke Bhaga"") (w/ Rashmeet Kaur)"
164,-3,"Shilpa Rao - Chuttamalle (From ""Devara Part 1"") (w/ Anirudh Ravichander, Ramajogayya Sastry)",318,3,(x10),204462,-1455.0,1465930,-712,142840438,Shilpa Rao,"Chuttamalle (From ""Devara Part 1"") (w/ Anirudh Ravichander, Ramajogayya Sastry)"
165,+23,Kamal Khan - Ishq Sufiyana (Male),214,31,,203980,13017.0,987903,9520,55498707,Kamal Khan,Ishq Sufiyana (Male)
166,RE,Yo Yo Honey Singh - Love Dose,371,27,,202924,,1116260,202924,83023165,Yo Yo Honey Singh,Love Dose
167,NEW,Kishore Kumar - Pal Pal Dil Ke Paas,1,167,,200370,,200370,200370,200370,Kishore Kumar,Pal Pal Dil Ke Paas
